,Topic,Question,Correct
0,Animals,Birds are the only animals that can fly.,False
1,Animals,Elephants are the largest land animals.,True
2,Animals,All snakes are venomous.,False
3,Animals,Bears hibernate because they need to sleep.,False
4,Animals,Rabbits can see well in the dark.,True
5,Animals,Dolphins are fish.,False
6,Animals,Bats are blind.,False
7,Animals,Alligators only live in the Amazon rainforest.,False
8,Animals,Camels store water in their humps.,True
9,Animals,Hawks and eagles are the same bird.,False
10,Animals,Sloths move quickly.,False
11,Animals,Sharks have bones.,False
12,Animals,Kangaroos only live in Africa.,False
13,Animals,Octopuses have eight legs.,True
14,Animals,Snails are insects.,False
15,Animals,Mosquitoes can transmit diseases.,True
16,Animals,Most spiders are harmful to humans.,False
17,Animals,Turtles can breathe through their mouths.,False
18,Animals,Koalas are bears.,False
19,Animals,Zebras can be domesticated.,False
20,Animals,Rhinoceroses have poor eyesight.,True
21,Animals,Llamas and alpacas are the same animal.,False
22,Animals,Gorillas are herbivores.,True
23,Animals,Lobsters are immortal.,False
24,Animals,Cows can sleep standing up.,True
25,Animals,Komodo dragons are mythical creatures.,False
26,Animals,Chameleons change color to blend in with their surroundings.,False
27,Animals,Sea otters hold hands while sleeping.,True
28,Animals,Pigs are dirty animals.,False
29,Animals,Bees only make honey.,False
30,Animals,Penguins only live in cold climates.,False
31,Animals,Anteaters eat only ants.,False
32,Animals,Crocodiles can regrow their teeth.,True
33,Animals,Owls can turn their heads entirely around.,False
34,Animals,Wolves are pack animals.,True
35,Animals,Hedgehogs are related to hamsters.,False
36,Animals,Foxes are nocturnal animals.,True
37,Animals,Giraffes have the same number of vertebrae as humans.,True
38,Animals,Horses' teeth never stop growing.,True
39,Animals,Most snakes lay eggs.,True
40,Animals,Emus can swim.,True
41,Animals,Cheetahs are the fastest land animals.,True
42,Animals,Gorillas can communicate using sign language.,True
43,Animals,Chickens can see in color.,True
44,Animals,Penguins can't fly.,True
45,Animals,Elephants can't jump.,True
46,Animals,Snakes can dislocate their jaws to swallow prey larger than their heads.,True
47,Animals,Dolphins have their own individual names for each other.,True
48,Animals,Orcas are actually a type of dolphin.,True
49,Plants,Plants absorb only carbon dioxide and release oxygen during photosynthesis.,False. Plants also absorb water and mineral nutrients from the soil during photosynthesis.
50,Plants,All plants require direct sunlight to survive.,"False. Some plants can survive in low light conditions, while others require only indirect sunlight."
51,Plants,All plants are able to produce flowers and fruits.,"False. Some plants are non-flowering and do not produce fruits, such as ferns and mosses."
52,Plants,All plants are edible and safe to consume.,"False. Some plants, such as poison ivy and nightshade, are toxic and can be deadly if ingested."
53,Plants,All plants have seeds as a means of reproduction.,"False. Some plants, such as ferns, use spores instead of seeds for reproduction."
54,Plants,Plants are capable of movement.,"True. Some plants, such as the Venus Flytrap, are able to move in response to stimuli."
55,Plants,All plants are able to conduct photosynthesis.,"False. Parasitic plants, such as the dodder plant, are not able to conduct photosynthesis and rely on other plants for sustenance."
56,Plants,Plants can only reproduce through sexual means.,False. Some plants can also reproduce asexually through methods such as vegetative propagation.
57,Plants,Plants are not able to adapt to changing environmental conditions.,False. Plants are able to adapt to changing conditions through mechanisms such as genetic diversity and epigenetics.
58,Plants,All plants are green in color.,"False. Some plants have different color pigments, such as the red pigments found in roses."
59,Plants,Plants do not require soil to grow.,"False. While there are some plants that can grow hydroponically, the majority of plants require soil for nutrient and water uptake."
60,Plants,All plants are able to photosynthesize at the same rate.,"False. Each plant species has a different photosynthetic rate, influenced by factors such as temperature and light intensity."
61,Plants,Plants do not require water for survival.,"False. Water is essential for plants to survive, as it is required for transportation of nutrients and maintenance of turgor pressure."
62,Plants,Plants do not require nutrients for growth.,"False. Nutrients, such as nitrogen and phosphorus, are essential for plant growth and development."
63,Plants,Plants are not affected by climate change.,"False. Climate change can have a significant impact on plant growth and distribution, as well as on the interactions between plants and their environment."
64,Plants,All plants are able to self-pollinate.,"False. Some plants require pollinators, such as bees or butterflies, to transfer pollen between flowers for fertilization."
65,Plants,Plants have no impact on human health.,False. Plants provide numerous benefits to human health through their medicinal properties and contribution to a healthy diet.
66,Plants,All plants are able to tolerate extreme temperatures.,"False. Some plants, such as tropical plants, may not be able to tolerate cold temperatures and vice versa."
67,Plants,Plants are not affected by pollution.,"False. Pollution can have a detrimental effect on plant growth and development, and can even lead to plant death."
68,Plants,All plants are capable of regenerating lost or damaged parts.,"True. Many plants are capable of regrowing lost or damaged parts, such as leaves or branches."
69,Plants,Plants are not able to communicate with other plants.,False. Plants are able to communicate with other plants through mechanisms such as chemical signaling.
70,Plants,All parts of a plant have the same function.,"False. Each part of a plant, such as leaves, stems, and roots, has a different function."
71,Plants,Plants do not require oxygen for survival.,"False. Plants require oxygen for cellular respiration, just like animals."
72,Plants,All plants are able to resist pests and disease.,"False. Some plants are more susceptible to pests and diseases, while others have evolved resistance mechanisms."
73,Plants,Plants can only be propagated through seeds.,False. Plants can also be propagated through methods such as cuttings and grafting.
74,Plants,All plant-based products are vegan.,"False. Some plant-based products, such as honey and beeswax, are not considered vegan."
75,Plants,All plants are able to fix atmospheric nitrogen.,"False. Only certain plants, such as legumes, are able to fix atmospheric nitrogen."
76,Plants,Plants are not affected by soil pH.,False. Soil pH can have a significant impact on plant growth and nutrient uptake.
77,Plants,All plants are able to perform cellular respiration.,"True. Plants, like all living organisms, perform cellular respiration to generate energy."
78,Plants,Plants are not able to defend themselves against predators.,"False. Plants have evolved numerous defense mechanisms, such as thorns and chemical compounds, to defend against predators."
79,Plants,All plants are able to produce oxygen.,"False. Some plants, such as underwater plants, produce carbon dioxide instead of oxygen through photosynthesis."
80,Plants,Plants are not affected by drought.,False. Drought can have a significant impact on plant growth and survival.
81,Plants,All plants are able to grow in all types of soil.,"False. Different plant species have different soil requirements, and some plants may not be able to grow in certain soil types."
82,Plants,Plants are not affected by radiation.,False. Radiation can have a detrimental effect on plant growth and development.
83,Plants,All plants require pruning to grow properly.,"False. While pruning can be beneficial for some plants, it is not always necessary for proper growth."
84,Plants,Plants have no impact on the global climate.,False. Plants play a significant role in the global carbon cycle and contribute to climate regulation.
85,Plants,All plants are able to grow at the same rate.,"False. Each plant species has a different growth rate, influenced by factors such as temperature, light, and nutrient availability."
86,Plants,All plants are able to grow in all climates.,False. Different plant species have different climate requirements and may not be able to grow in certain climates.
87,Plants,Plants are not affected by the seasons.,False. Plants are able to detect changes in light and temperature that herald the arrival of different seasons and may adapt their growth accordingly.
88,Plants,All plants have the same nutritional value.,"False. Different plant species have different nutritional profiles, and some may be more nutrient-dense than others."
89,Plants,All plants are able to adapt to soil salinity.,"False. Some plants are more salt-tolerant than others, and some may not be able to grow in soil with high salt content."
90,Plants,Plants do not require specific wavelengths of light for photosynthesis.,"False. Plants require specific wavelengths of light, such as red and blue, for optimal photosynthesis."
91,Plants,All plants are able to grow hydroponically.,"False. While some plants can grow hydroponically, not all plant species may be suitable for this growing method."
92,Plants,Plants are not affected by urbanization.,"False. Urbanization can have a significant impact on plant growth and distribution, as well as on the interactions between plants and their environment."
93,Plants,All plants are able to thrive in the same environmental conditions.,"False. Each plant species has specific environmental requirements, and some may be more tolerant of harsh environmental conditions than others."
94,Plants,Plants do not require a specific pH range for soil fertility.,False. Soil pH can have a significant impact on soil fertility and nutrient availability for plants.
95,Plants,All plants have thorns.,"False. While some plants have thorns, not all plant species have this feature."
96,Plants,Photosynthesis only occurs during the day.,"False. Photosynthesis can occur both during the day and night, although the rate of production may differ."
97,Plants,Plants do not require fresh air.,False. Plants require access to fresh air to carry out respiration.
98,Plants,All plants are able to tolerate high levels of pollution.,False. Some plants are more sensitive to pollution and may not be able to tolerate high levels of pollutants in the air or soil.
99,Food and drink,Eating carbs will always make you gain weight.,False.
100,Food and drink,Fresh fruits are healthier than frozen fruits.,False.
101,Food and drink,Drinking cold water slows down your metabolism.,False.
102,Food and drink,Eating after 8 pm will cause you to gain weight.,False.
103,Food and drink,Drinking lots of coffee can dehydrate you.,False.
104,Food and drink,All fats are unhealthy.,False.
105,Food and drink,Drinking 8 cups of water a day is an absolute necessity.,False.
106,Food and drink,Eating spicy food will give you an ulcer.,False.
107,Food and drink,Energy drinks are healthier than soda.,False.
108,Food and drink,Margarine is healthier than butter.,False.
109,Food and drink,Soy products cause cancer.,False.
110,Food and drink,Eating a lot of red meat will give you heart disease.,False.
111,Food and drink,Salads are always healthier than burgers.,False.
112,Food and drink,Eating too many eggs will give you high cholesterol.,False.
113,Food and drink,Sugar is the main cause of hyperactivity in children.,False.
114,Food and drink,Eating fruit on an empty stomach helps with digestion.,False.
115,Food and drink,Brown sugar is healthier than white sugar.,False.
116,Food and drink,Drinking alcohol kills brain cells.,False.
117,Food and drink,All gluten-free foods are healthier.,False.
118,Food and drink,Eating too much salt causes high blood pressure.,True.
119,Food and drink,Drinking soda through a straw will protect your teeth.,False.
120,Food and drink,Eating chocolate gives you acne.,False.
121,Food and drink,Drinking hot tea can cool you down.,True.
122,Food and drink,Drinking vinegar can help you lose weight.,False.
123,Food and drink,Skipping breakfast is a good way to lose weight.,False.
124,Food and drink,Eating celery burns more calories than it provides.,True.
125,Food and drink,Eating too much protein is bad for your kidneys.,False.
126,Food and drink,Artificial sweeteners are healthier than sugar.,False.
127,Food and drink,Drinking milk causes mucus production.,False.
128,Food and drink,Drinking red wine is good for your heart.,True.
129,Food and drink,Eating at night will give you nightmares.,False.
130,Food and drink,Eating cheese before bed gives you bad dreams.,False.
131,Food and drink,The food pyramid is the best way to organize your diet.,False.
132,Food and drink,Drinking warm water with lemon in the morning can help with digestion.,True.
133,Food and drink,Eating bananas can help with muscle cramps.,True.
134,Food and drink,Eating carbs before bed will cause weight gain.,False.
135,Food and drink,Eating sushi will make you sick.,False.
136,Food and drink,Drinking too much water will flush out all the nutrients from your body.,False.
137,Food and drink,Eating too many carrots can turn your skin orange.,True.
138,Food and drink,Eating turmeric can help reduce inflammation.,True.
139,Food and drink,Drinking alcohol before bed will help you sleep.,False.
140,Food and drink,Eating sugar causes diabetes.,False.
141,Food and drink,Drinking coffee is bad for your health.,False.
142,Food and drink,Eating garlic repels mosquitoes.,True.
143,Food and drink,Drinking water before a meal helps you lose weight.,True.
144,Food and drink,Eating spicy food before bed gives you nightmares.,False.
145,Food and drink,Drinking warm milk before bed helps you sleep.,True.
146,Food and drink,Eating carbs is bad for your health.,False.
147,Food and drink,Drinking too much coffee will dehydrate you.,False.
148,Music,All musicians are wealthy.,False
149,Music,Music can be only enjoyed if it is familiar.,False
150,Music,"The louder the music, the better it sounds.",False
151,Music,Playing an instrument is easy and anyone can do it.,False
152,Music,Music is only for entertainment purposes.,False
153,Music,Being a musician is a glamorous lifestyle.,False
154,Music,Only people with perfect pitch can be good singers.,False
155,Music,Music does not have any health benefits.,False
156,Music,Listening to music while studying or working is always helpful.,False
157,Music,Music affects a person's mood.,True
158,Music,A classical musician cannot enjoy other genres of music.,False
159,Music,Music is a universal language.,True
160,Music,Singing high notes damages a person's vocal cords.,False
161,Music,Playing music decreases stress levels.,True
162,Music,Music can be used as a form of therapy.,True
163,Music,Listening to music with violent lyrics will make a person more aggressive.,False
164,Music,It is impossible to learn an instrument as an adult.,False
165,Music,Musicians don't need a formal education.,False
166,Music,Listening to music before bed can improve sleep quality.,True
167,Music,Any type of music is suitable for any situation.,False
168,Music,Musicians have to be naturally talented.,False
169,Music,Music videos always accurately represent the song's message.,False
170,Music,The length of a song defines its quality.,False
171,Music,Memorizing music is an easy task.,False
172,Music,It is impossible to enjoy music in another language.,False
173,Music,Famous musicians are always good role models.,False
174,Music,Using auto-tune is cheating in music.,False
175,Music,Technology has negatively impacted music.,False
176,Music,Making music requires expensive equipment.,False
177,Music,Music can be enjoyed even with a hearing disability.,True
178,Music,Learning music theory is not important for musicians.,False
179,Music,Practicing the same song repeatedly leads to progress.,True
180,Music,You can only be a musician if you're good at playing an instrument.,False
181,Music,Listening to music while exercising improves performance.,True
182,Music,Music education is not necessary for a career in music.,False
183,Music,Children who learn music perform better academically.,True
184,Music,All music has to have lyrics.,False
185,Music,Listening to music can improve your memory.,True
186,Music,Music taste is subjective.,True
187,Music,It is more difficult to learn to play an instrument than to sing.,False
188,Music,Playing music is only a hobby and can't be a career.,False
189,Music,Listening to music in a foreign language can help with language learning.,True
190,Music,Music streaming services have made music more accessible than ever before.,True
191,Music,The amount of money a musician makes is directly correlated with their talent.,False
192,Music,You have to be able to read sheet music to play an instrument.,False
193,Music,Playing a musical instrument improves hand-eye coordination.,True
194,Music,Musicians can only make money through album sales.,False
195,Music,Music can be used to bring people from different cultures together.,True
196,Music,It is possible to enjoy a song but dislike the artist.,True
197,Music,Playing music can help delay the effects of aging on the brain.,True
198,Music,Music has been proven to reduce anxiety levels.,True
199,Movies,Movies are always filmed in the same order that we see them on screen.,False
200,Movies,All movies that are based on true stories are completely accurate.,False
201,Movies,The actors in a movie always film their scenes together.,False
202,Movies,Movies always make a profit at the box office.,False
203,Movies,Popular actors and actresses are always the highest-paid members of a movie's production team.,False
204,Movies,Animated movies are only for children.,False
205,Movies,Directors always have full creative control over every aspect of the movie.,False
206,Movies,Every scene in a movie is filmed in a single take.,False
207,Movies,Movies filmed in black and white are older than those filmed in color.,True
208,Movies,Movies are made solely for entertainment purposes.,False
209,Movies,The length of a movie always determines its quality.,False
210,Movies,A movie with a large budget is guaranteed to be successful.,False
211,Movies,All movies must have a happy ending.,False
212,Movies,Every movie is required to have a soundtrack.,False
213,Movies,A movie's success depends solely on its box office earnings.,False
214,Movies,Actors never use stunt doubles.,False
215,Movies,Directors always work with the same actors repeatedly.,False
216,Movies,Movies that receive prestigious awards are always the highest-grossing at the box office.,False
217,Movies,The actors in a movie are always responsible for their own hair and makeup.,False
218,Movies,Movies can always be categorized into one specific genre.,False
219,Movies,A movie’s trailer features all the best parts of the film.,False
220,Movies,Directors always use special effects to make their movies more exciting.,False
221,Movies,Every movie that is released is available in every country at the same time.,False
222,Movies,Movies can always be fully enjoyed without subtitles or dubbing in a language that is not native to the viewer.,False
223,Movies,"In every movie, the main character is always the protagonist.",True
224,Movies,Every movie is based on a preexisting story or idea.,False
225,Movies,Movies are always rated based solely on the quality of their content.,False
226,Movies,All great movie directors are male.,False
227,Movies,Directors cannot change the script during filming.,False
228,Movies,"In a movie that features multiple languages, the characters always speak each language accurately.",False
229,Movies,Every actor auditioning for a role must have the same appearance as the main character in the script.,False
230,Movies,All movies are filmed on location.,False
231,Movies,All movies should be enjoyed in a theater.,False
232,Movies,Every movie follows a three-act structure.,False
233,Movies,The box office success of a movie is always an accurate reflection of its critical reception.,False
234,Movies,Every movie is reviewed by professional critics.,False
235,Movies,Successful actors and actresses always have formal acting training.,False
236,Movies,Movies always depict realistic situations.,False
237,Movies,Every movie has a clear-cut villain.,False
238,Movies,The level of violence in a movie always determines its age rating.,False
239,Movies,A movie that wins an Academy Award is automatically a masterpiece.,False
240,Movies,Every movie features a romantic storyline.,False
241,Movies,The release date of a movie is always the same worldwide.,False
242,Movies,Movies are always edited in chronological order.,False
243,Movies,Movies that are marketed towards children always have age-appropriate content.,False
244,Movies,The director is always the highest-paid member of a movie's production team.,False
245,Movies,The full cast and crew of a movie are always listed in the end credits.,True
246,Movies,All actors use their real names when they appear in movies.,False
247,Movies,Every movie requires a large budget to be successful.,False
248,Television shows,Television shows are always live broadcasts.,False
249,Television shows,Television shows are always filmed in order and without interruptions.,False
250,Television shows,Television shows are only created to make a profit.,False
251,Television shows,Television shows always accurately represent real life situations.,False
252,Television shows,Television shows are always produced by major network companies.,False
253,Television shows,Reality television shows are completely unscripted.,False
254,Television shows,Television shows are only watched by people in developed countries.,False
255,Television shows,Children's television shows are always appropriate for all ages.,False
256,Television shows,Television shows are never censored or edited.,False
257,Television shows,Binge-watching television shows can have negative impacts on mental health.,True
258,Television shows,Television shows can never accurately portray a book or novel.,False
259,Television shows,Most television shows are created and written by one person.,False
260,Television shows,Television shows always accurately depict historical events.,False
261,Television shows,Television shows are only watched on traditional TV sets.,False
262,Television shows,Animated television shows are only for children.,False
263,Television shows,Most television shows are cancelled after the first season.,True
264,Television shows,Television shows can positively impact mental health by providing an escape.,True
265,Television shows,Television shows are never dubbed or translated into other languages.,False
266,Television shows,Fictional television shows can accurately depict societal issues.,True
267,Television shows,Television shows have no impact on cultural or societal norms.,False
268,Television shows,Television shows are only created and produced in the United States.,False
269,Television shows,Most television shows are created based on popular demand from viewers.,False
270,Television shows,Television shows never include product placement or advertising.,False
271,Television shows,Television shows are not a form of art.,False
272,Television shows,Television shows always have a political or social message.,False
273,Television shows,Television shows are never remade or rebooted.,False
274,Television shows,Television shows can accurately depict mental health issues.,True
275,Television shows,The quality of a television show is based solely on its budget.,False
276,Television shows,Television shows never have special guest appearances from celebrities.,False
277,Television shows,Most television shows have the same exact plot every episode.,False
278,Television shows,Television shows are only watched for entertainment purposes.,False
279,Television shows,Fictional television shows can improve empathy and understanding of others.,True
280,Television shows,Television shows can accurately depict different cultures and lifestyles.,True
281,Television shows,Television shows have no lasting impact on society or culture.,False
282,Television shows,Television shows are never adapted into films.,False
283,Television shows,Most television shows have a predetermined ending.,False
284,Television shows,Animated television shows always have underlying messages for children.,False
285,Television shows,Television shows are never released on streaming services.,False
286,Television shows,Television shows are always filmed on location.,False
287,Television shows,Historical television shows are always 100% accurate to real life events.,False
288,Television shows,Most television shows are aimed towards a specific demographic.,True
289,Television shows,Television shows never have spin-offs or sequels.,False
290,Television shows,Fictional television shows can accurately depict mental illnesses.,True
291,Television shows,Television shows are never adapted from novels or books.,False
292,Television shows,Most television shows have a hidden or underlying message.,True
293,Television shows,Television shows are only watched by those who own a TV.,False
294,Television shows,Television shows are a waste of time and have no value.,False
295,Television shows,Most television shows have a predetermined number of seasons before cancellation.,False
296,Television shows,Animated television shows are only for entertainment.,False
297,Literature,Literature is only written in English.,False
298,Literature,All famous books have been turned into successful movies.,False
299,Literature,Reading is a passive activity that doesn't engage the brain.,False
