,Topic,Question,Correct
1786,Human Rights,Human rights only apply to people who are wealthy or powerful.,False
1787,Human Rights,"Human rights only protect positive liberties, not negative liberties.",False
1788,Human Rights,Human rights can only be enforced by courts and other legal mechanisms.,False
1789,Human Rights,Human rights only apply to issues of life and death.,False
1790,Human Rights,Human rights do not apply to undocumented migrants.,False
1791,Human Rights,"Human rights are only relevant in certain parts of the world, not globally.",False
1792,Human Rights,Human rights can be suspended during times of public health emergencies.,False
1793,Human Rights,"Human rights only protect certain groups, like women or LGBTQ+ individuals.",False
1794,Human Rights,"The concept of human rights is only applicable to individuals, and not to groups or collectives.",False
1795,Current Events/News,Most news outlets report completely unbiased news.,False.
1796,Current Events/News,Social media is a reliable source of news.,False.
1797,Current Events/News,The news media is only concerned with reporting the truth.,False.
1798,Current Events/News,News journalists are trained to avoid and recognize biases.,True.
1799,Current Events/News,News reported through satire shows often provides more accurate information than news shows that claim to be serious.,False.
1800,Current Events/News,The majority of news organizations adhere to strict ethical standards when reporting on news events.,True.
1801,Current Events/News,All news articles contain factual information.,False.
1802,Current Events/News,Mainstream news outlets are often criticized for only reporting negative news stories.,True.
1803,Current Events/News,News outlets always report the whole truth.,False.
1804,Current Events/News,News organizations from different countries often report completely different news.,True.
1805,Current Events/News,Personal opinions of news reporters do not affect their reporting of a story.,False.
1806,Current Events/News,Fake news is only shared through social media.,False.
1807,Current Events/News,Many news sources use clickbait titles to attract more readers.,True.
1808,Current Events/News,All news stories are fact-checked before publication.,False.
1809,Current Events/News,One news story can have many different interpretations depending on who is reporting it.,True.
1810,Current Events/News,The media always reports on important news stories equally.,False.
1811,Current Events/News,The media is responsible for shaping public opinion.,True.
1812,Current Events/News,People who consume news via social media tend to have more balanced viewpoints than those who consume traditional news sources such as television or newspapers.,False.
1813,Current Events/News,News sources rarely make errors in their reporting.,False.
1814,Current Events/News,Most news organizations follow a strict code of ethics.,True.
1815,Current Events/News,Media bias has no effect on people’s views on current events.,False.
1816,Current Events/News,News that is shared through text messages is more reliable than news that is shared on social media.,False.
1817,Current Events/News,A journalist’s opinion does not belong in a news story.,True.
1818,Current Events/News,News outlets are always objective and impartial.,False.
1819,Current Events/News,The media often sensationalizes news events in order to attract more viewers/readers.,True.
1820,Current Events/News,People who consume the news from a variety of sources are more likely to have a balanced view of current events.,True.
1821,Current Events/News,Some news sources are more reliable than others.,True.
1822,Current Events/News,News reports only feature stories that are relevant to a broad audience.,False.
1823,Current Events/News,News organizations are not influenced by advertisers or corporate sponsors.,False.
1824,Current Events/News,Speculative news stories can still influence the public’s perception of current events.,True.
1825,Current Events/News,News articles are often written with the intention of instilling fear in the reader.,True.
1826,Current Events/News,Hedge funds buying up newspapers is good for the journalism industry.,False.
1827,Current Events/News,Biased news is less of an issue in countries with state-run media.,False.
1828,Current Events/News,Local news sources are often more reliable than national news sources.,True.
1829,Current Events/News,The quality of news reporting has improved with the advent of social media.,False.
1830,Current Events/News,News articles are always free from political leanings.,False.
1831,Current Events/News,Alternative news sources are more trustworthy than traditional news sources.,False.
1832,Current Events/News,The news media has a responsibility to report on both positive and negative news events.,True.
1833,Current Events/News,A journalist’s personal beliefs cannot affect their reporting of a story.,False.
1834,Current Events/News,The public has the responsibility to fact-check news stories before believing them.,True.
1835,Current Events/News,News stories are only reported after all the facts have been gathered and verified.,False.
1836,Current Events/News,The news media is responsible for uncovering government corruption and misconduct.,True.
1837,Current Events/News,The media is often biased against certain political viewpoints.,True.
1838,Current Events/News,News articles are only written with the intention of informing the reader.,False.
1839,Current Events/News,News sources from different political affiliations often report completely different news.,True.
1840,Current Events/News,Journalists are trained to present both sides of a story.,True.
1841,Current Events/News,News articles can still contain biases even if the facts presented are true.,True.
1842,Current Events/News,The majority of people still get their news from traditional news sources such as television or newspapers.,False.
1843,Current Events/News,The media is responsible for giving attention to important news stories that may otherwise go unnoticed.,True.
1844,Global Affairs,The United Nations has the power to independently enforce its resolutions.,False
1845,Global Affairs,The G7 consists of the world's seven largest economies.,True
1846,Global Affairs,Terrorism is a tactic only used by non-state actors.,False
1847,Global Affairs,The International Criminal Court has authority over all individuals around the world.,False
1848,Global Affairs,The United States is a member of the International Court of Justice.,True
1849,Global Affairs,The World Bank provides funding exclusively to developing countries.,False
1850,Global Affairs,There are currently no ongoing armed conflicts in Africa.,False
1851,Global Affairs,The International Monetary Fund regulates the global gold market.,False
1852,Global Affairs,The European Union has a unified foreign policy towards all countries.,False
1853,Global Affairs,The World Health Organization is responsible for regulating pharmaceutical companies.,False
1854,Global Affairs,"The term ""Brexit"" refers to Britain's exit from the United Nations.",False
1855,Global Affairs,The International Committee of the Red Cross is authorized to enforce the Geneva Conventions.,False
1856,Global Affairs,The UN Security Council consists of 10 permanent members and 5 rotating members.,False
1857,Global Affairs,The North Atlantic Treaty Organization (NATO) is an economic alliance.,False
1858,Global Affairs,The World Trade Organization has the authority to impose sanctions on countries that violate its rules.,True
1859,Global Affairs,"The term ""globalization"" refers to the process of countries becoming more isolated from one another.",False
1860,Global Affairs,The Organization of Petroleum Exporting Countries (OPEC) is made up entirely of African countries.,False
1861,Global Affairs,The International Atomic Energy Agency is responsible for monitoring compliance with the Nuclear Non-Proliferation Treaty.,True
1862,Global Affairs,The European Union is a military alliance.,False
1863,Global Affairs,The United Nations is funded entirely by member states' contributions.,True
1864,Global Affairs,"The term ""soft power"" refers to a country's military strength.",False
1865,Global Affairs,The United States has veto power in the UN Security Council.,True
1866,Global Affairs,"The North American Free Trade Agreement (NAFTA) includes Canada, the United States, and Mexico.",True
1867,Global Affairs,The United Nations has the power to impose taxes on member states.,False
1868,Global Affairs,"The International Criminal Court can only prosecute individuals for crimes committed after July 1, 2002.",True
1869,Global Affairs,The Group of 20 (G20) represents the 20 largest economies in the world.,True
1870,Global Affairs,The International Labor Organization regulates workplace safety standards worldwide.,False
1871,Global Affairs,The Paris Agreement is an agreement to combat climate change.,True
1872,Global Affairs,The United States is not a member of the United Nations Human Rights Council.,False
1873,Global Affairs,The World Health Organization is responsible for coordinating the global response to pandemics.,True
1874,Global Affairs,The International Monetary Fund provides loans to help countries overcome financial crises.,True
1875,Global Affairs,The European Union has a common currency.,True
1876,Global Affairs,The United Nations General Assembly is made up of representatives from all member states.,True
1877,Global Affairs,The World Bank is responsible for promoting international trade.,False
1878,Global Affairs,The International Court of Justice is the principal judicial body of the United Nations.,True
1879,Global Affairs,"The United Nations Educational, Scientific and Cultural Organization (UNESCO) is responsible for regulating global education systems.",False
1880,Global Affairs,The World Economic Forum is an annual gathering of global political and business leaders.,True
1881,Global Affairs,The International Committee of the Red Cross provides humanitarian aid in armed conflicts.,True
1882,Global Affairs,The United States is a member of the World Health Organization.,False
1883,Global Affairs,The North Atlantic Treaty Organization (NATO) was formed as a response to Soviet aggression.,True
1884,Global Affairs,The International Atomic Energy Agency is responsible for verifying that countries are not secretly developing nuclear weapons.,True
1885,Global Affairs,The United Nations has the power to intervene militarily in sovereign nations.,False
1886,Global Affairs,"The International Criminal Court can only prosecute individuals for genocide, crimes against humanity, and war crimes.",True
1887,Global Affairs,The World Trade Organization has the power to enforce its decisions through trade sanctions.,True
1888,Global Affairs,The European Union has a unified army.,False
1889,Global Affairs,The United Nations has the power to control the internet.,False
1890,Global Affairs,The World Bank is a part of the United Nations system.,True
1891,Global Affairs,The International Monetary Fund is headquartered in Paris.,False
1892,Global Affairs,"The term ""nation-state"" refers to a country where one ethnicity dominates.",True
1893,Global Affairs,The International Labour Organization is based in New York.,False
1894,National Landmarks,National landmarks only refer to man-made structures.,False
1895,National Landmarks,All national landmarks are open to the public.,False
1896,National Landmarks,National landmarks are only found in the United States.,False
1897,National Landmarks,The Statue of Liberty is the tallest national landmark in the United States.,False
1898,National Landmarks,National landmarks are protected by law.,True
1899,National Landmarks,National landmarks are owned by the federal government.,False
1900,National Landmarks,All national landmarks receive funding from the government.,False
1901,National Landmarks,Mount Rushmore was originally intended to be a national monument.,True
1902,National Landmarks,The Golden Gate Bridge is a national landmark.,True
1903,National Landmarks,The Washington Monument is made of granite.,True
1904,National Landmarks,National landmarks are only designated by the president.,False
1905,National Landmarks,Alcatraz Island is a national landmark.,True
1906,National Landmarks,Niagara Falls is a national landmark.,False
1907,National Landmarks,The Grand Canyon is a national landmark.,True
1908,National Landmarks,National landmarks can be removed from the list if they no longer meet certain criteria.,True
1909,National Landmarks,The White House is a national landmark.,True
1910,National Landmarks,There are more national landmarks than national parks in the United States.,False
1911,National Landmarks,National landmarks can be privately owned.,True
1912,National Landmarks,The Gateway Arch in St. Louis is a national park.,True
1913,National Landmarks,National landmarks are only found on land.,False
1914,National Landmarks,The Hollywood Sign is a national landmark.,False
1915,National Landmarks,Pearl Harbor is a national landmark.,True
1916,National Landmarks,Ellis Island is a national landmark.,True
1917,National Landmarks,The Space Needle in Seattle is a national landmark.,False
1918,National Landmarks,The Grand Tetons are a national landmark.,False
1919,National Landmarks,National landmarks are only designated for their historical significance.,False
1920,National Landmarks,The Vietnam Veterans Memorial is a national landmark.,True
1921,National Landmarks,National landmarks are maintained by the National Park Service.,False
1922,National Landmarks,The Lincoln Memorial is made of marble.,True
1923,National Landmarks,The Gateway Arch is the tallest national landmark in the United States.,True
1924,National Landmarks,National landmarks are designated to preserve cultural heritage.,True
1925,National Landmarks,The Liberty Bell is a national landmark.,True
1926,National Landmarks,The National Mall in Washington D.C. is a national landmark.,False
1927,National Landmarks,The Hoover Dam is a national landmark.,True
1928,National Landmarks,The Empire State Building is a national landmark.,False
1929,National Landmarks,The Golden Gate Bridge was originally painted green.,False
1930,National Landmarks,The Brooklyn Bridge is a national landmark.,True
1931,National Landmarks,The Hollywood Walk of Fame is a national landmark.,False
1932,National Landmarks,National landmarks are only designated for their natural beauty.,False
1933,National Landmarks,The Lincoln Memorial is located on the National Mall in Washington D.C.,True
1934,National Landmarks,The Jefferson Memorial is made of bronze.,False
1935,National Landmarks,The National Cathedral in D.C. is a national landmark.,True
1936,National Landmarks,The Space Needle was built for the 1962 World's Fair.,True
1937,National Landmarks,The Grand Canyon was designated a national landmark by Teddy Roosevelt.,True
1938,National Landmarks,National landmarks are limited to the United States.,False
1939,National Landmarks,The Brooklyn Bridge was originally called the New York and Brooklyn Bridge.,True
1940,National Landmarks,The Gateway Arch was completed in 1965.,True
1941,National Landmarks,The National Mall in D.C. is home to the Lincoln Memorial.,True
1942,National Landmarks,The Golden Gate Bridge was completed in 1937.,True
1943,Celebrities and Entertainment,Tom Cruise is taller than Justin Bieber.,True
1944,Celebrities and Entertainment,Taylor Swift is the only musician to win a Grammy Award for Album of the Year three times.,False
1945,Celebrities and Entertainment,The character of Rocky Balboa was played by Sylvester Stallone in all eight Rocky movies.,True
1946,Celebrities and Entertainment,"Jennifer Lawrence won an Academy Award for her role in the movie ""Hunger Games.""",False
1947,Celebrities and Entertainment,Michael Jordan is the all-time leading scorer in NBA history.,False
1948,Celebrities and Entertainment,Beyoncé's real name is Beyoncé Knowles.,True
1949,Celebrities and Entertainment,The character of James Bond has been played by more than 10 actors in official movies.,False
1950,Celebrities and Entertainment,Jennifer Aniston has never won an Emmy Award for her role in Friends.,False
1951,Celebrities and Entertainment,"Madonna's first hit song was ""Like a Virgin.""",False
1952,Celebrities and Entertainment,"Leonardo DiCaprio won an Oscar for his role in the movie ""Wolf of Wall Street.""",False
1953,Celebrities and Entertainment,Ellen DeGeneres has never hosted the Oscars.,False
1954,Celebrities and Entertainment,"The highest-grossing movie of all time is ""Avatar.""",True
1955,Celebrities and Entertainment,Angelina Jolie is older than Brad Pitt.,False
1956,Celebrities and Entertainment,The character of Captain Jack Sparrow was played by Orlando Bloom in the Pirates of the Caribbean movies.,False
1957,Celebrities and Entertainment,Ariana Grande began her career as a Broadway actress.,True
1958,Celebrities and Entertainment,Meryl Streep has won the most Academy Awards of any actor.,True
1959,Celebrities and Entertainment,The character of Tony Stark was played by Chris Evans in the Marvel Cinematic Universe.,False
1960,Celebrities and Entertainment,Mariah Carey has sold more records than Madonna.,False
1961,Celebrities and Entertainment,"The movie ""Forrest Gump"" was directed by Steven Spielberg.",False
1962,Celebrities and Entertainment,Jennifer Lopez is older than Shakira.,True
1963,Celebrities and Entertainment,"Bruce Willis played the lead role in the movie ""Die Hard.""",True
1964,Celebrities and Entertainment,The Beatles were originally from the United States.,False
1965,Celebrities and Entertainment,Emma Watson played the character of Hermione Granger in the Harry Potter movies.,True
1966,Celebrities and Entertainment,"The voice of Simba in the original ""Lion King"" movie was provided by Jonathan Taylor Thomas.",True
1967,Celebrities and Entertainment,George Clooney has won an Academy Award for Best Director.,False
1968,Celebrities and Entertainment,"The character of Darth Vader was played by multiple actors in the original ""Star Wars"" trilogy.",True
1969,Celebrities and Entertainment,Madonna has won an Academy Award for Best Original Song.,True
1970,Celebrities and Entertainment,The highest-grossing movie franchise of all time is the Harry Potter series.,False
1971,Celebrities and Entertainment,Brad Pitt has won an Emmy Award for his acting.,False
1972,Celebrities and Entertainment,The Rolling Stones have released more albums than The Beatles.,True
1973,Celebrities and Entertainment,Robert Downey Jr. played the character of Sherlock Holmes in a movie directed by Guy Ritchie.,True
1974,Celebrities and Entertainment,Lady Gaga's real name is Stefani Joanne Angelina Germanotta.,True
1975,Celebrities and Entertainment,"The character of Darth Maul appears in the original ""Star Wars"" trilogy.",False
1976,Celebrities and Entertainment,"Will Smith played the lead role in the movie ""The Pursuit of Happyness.""",True
1977,Celebrities and Entertainment,"The highest-grossing movie of all time directed by a woman is ""Frozen 2.""",False
1978,Celebrities and Entertainment,The character of Jack Sparrow is based on a real person.,True
1979,Celebrities and Entertainment,"Adele's first hit song was ""Rolling in the Deep.""",True
1980,Celebrities and Entertainment,"The movie ""Casablanca"" won the Academy Award for Best Picture in 1943.",True
1981,Celebrities and Entertainment,"The character of Batman was played by George Clooney in the movie ""Batman & Robin.""",True
1982,Celebrities and Entertainment,"Pink Floyd's best-selling album is ""The Dark Side of the Moon.""",True
1983,Celebrities and Entertainment,The character of Steve Rogers is played by Chris Evans in the Marvel Cinematic Universe movies.,True
1984,Celebrities and Entertainment,"The highest-grossing movie of all time directed by a man is ""Avatar.""",True
1985,Celebrities and Entertainment,The character of Rocky Balboa was inspired by a real-life boxer named Rocky Marciano.,True
1986,Celebrities and Entertainment,"Quentin Tarantino directed the movie ""The Shawshank Redemption.""",False
1987,Celebrities and Entertainment,The character of Iron Man was played by Christian Bale in the Marvel Cinematic Universe.,False
1988,Celebrities and Entertainment,"The highest-grossing movie of all time not produced by Disney is ""Jurassic World.""",True
1989,Celebrities and Entertainment,"The character of Hannibal Lecter was played by Anthony Hopkins in ""The Silence of the Lambs.""",True
1990,Celebrities and Entertainment,"The movie ""The Godfather"" was directed by Martin Scorsese.",False
1991,Celebrities and Entertainment,"The character of Rose DeWitt Bukater was played by Kate Winslet in ""Titanic.""",True
1992,Celebrities and Entertainment,"The highest-grossing movie of all time at the box office is ""Avengers: Endgame.""",True.
1993,Nature,Nature is an infinite resource that can provide endlessly.,False
1994,Nature,Natural disasters occur because nature is unpredictable.,True
1995,Nature,The depletion of natural resources is not a concern because nature replenishes itself.,False
1996,Nature,The extinction of certain animal species will not affect humans.,False
1997,Nature,Climate change is a hoax perpetrated by the government.,False
1998,Nature,Nature is impervious to human influence.,False
1999,Nature,It is impossible for humans to fully understand the complexities of nature.,True
2000,Nature,Natural remedies are always safer than medicine.,False
2001,Nature,The growth of human population has no impact on natural habitats.,False
2002,Nature,It's safe to approach wild animals in their natural habitat.,False
2003,Nature,National parks and nature reserves are unnecessary because nature can take care of itself.,False
2004,Nature,Natural disasters are just a natural part of the earth's cycle.,True
2005,Nature,Plants and animals in nature do not communicate with each other.,False
2006,Nature,Nature has no effect on human health.,False
2007,Nature,Natural beauty is subjective and varies from person to person.,True
2008,Nature,Natural materials are always more environmentally friendly than synthetic materials.,False
2009,Nature,Pesticides and other chemicals have no negative impact on nature.,False
2010,Nature,Natural disasters always cause more harm than good.,False
2011,Nature,Humans can live without nature.,False
2012,Nature,Nature is always beneficial to humans.,False
2013,Nature,Recycling is not necessary because nature will decompose waste.,False
2014,Nature,Cultivated crops are always more beneficial to nature than wild plants.,False
2015,Nature,The earth's natural resources will never run out.,False
2016,Nature,The use of renewable energy sources will not affect nature in any way.,False
2017,Nature,It is safe to swim in natural bodies of water without concern for water safety.,False
2018,Nature,Natural disasters only occur in certain parts of the world.,False
2019,Nature,Nature can heal itself from any damage we cause.,False
2020,Nature,Exposure to nature has no impact on mental health.,False
2021,Nature,Human activity has no impact on the natural world.,False
2022,Nature,Hunting and trapping animals in their natural habitat is always illegal.,False
2023,Nature,Natural disasters only occur due to geological reasons.,False
2024,Nature,It is always safe to eat wild plants and berries found in nature.,False
2025,Nature,The use of fossil fuels has no impact on the environment.,False
2026,Nature,"Nature is always beautiful, never ugly.",False
2027,Nature,"Air pollution only occurs in urban areas, not in naturally rural areas.",False
2028,Nature,It is safe for humans to consume animals that have died of natural causes in the wild.,False
2029,Nature,Natural disasters are always caused by human activity.,False
2030,Nature,Humans have no responsibility to protect and preserve nature.,False
2031,Nature,Trees and plants do not provide any benefits to the environment or wildlife.,False
2032,Nature,All natural products are beneficial to humans.,False
2033,Nature,The earth's climate has not changed significantly over time.,False
2034,Nature,Nature can only be appreciated if it is untouched by humans.,False
2035,Nature,Poaching and hunting endangered species is always illegal.,False
2036,Nature,The eradication of entire species of animals and plants will have no negative impact on nature.,False
2037,Nature,Humans cannot learn anything from observing nature.,False
2038,Nature,Nature is always more complex than human-made designs.,True
2039,Nature,There is no overlap between human civilization and nature.,False
2040,Nature,It is impossible to replicate nature in human-made designs.,True
2041,Nature,Nature is always able to provide what humans need.,False
2042,Nature,Human-made pollution does not have a significant effect on the air or water in nature.,False
2043,Cooking and Baking,Cooking oil can never be reused.,False.
2044,Cooking and Baking,Baking soda and baking powder are interchangeable.,False.
2045,Cooking and Baking,Kneading dough for a longer time will always result in a better texture.,False.
2046,Cooking and Baking,Adding salt to water will make it boil faster.,True.
2047,Cooking and Baking,Raw chicken needs to be rinsed under water before cooking.,False.
2048,Cooking and Baking,Using a metal utensil on a non-stick pan will damage the coating.,True.
2049,Cooking and Baking,Cooking with aluminum foil can cause Alzheimer's disease.,False.
2050,Cooking and Baking,Adding wine to a hot pan will ignite a flame.,True.
2051,Cooking and Baking,Eggshells should be washed before cracking them.,False.
2052,Cooking and Baking,Lemons can be used to clean a cutting board.,True.
2053,Cooking and Baking,Cutting an onion will always make you cry.,False.
2054,Cooking and Baking,Cooking with garlic can improve heart health.,True.
