,Topic,Question,Correct
650,Technology,Technology has brought about significant improvements in the quality of life.,True
651,Technology,Technology has made us more efficient in our daily lives.,True
652,Technology,"The more technology we have, the less we need human interaction.",False
653,Technology,Technology has made learning easier and more accessible.,True
654,Technology,The rise of technology has created fewer job opportunities for people.,False
655,Technology,Technology has made it harder to protect our personal information.,True
656,Technology,The internet is the same as the World Wide Web.,False
657,Technology,The first computer was invented in the early 1900s.,False
658,Technology,"Wi-Fi is short for ""wireless fidelity"".",True
659,Technology,Social media is for younger generations only.,False
660,Technology,Virtual reality is only used for video gaming.,False
661,Technology,Augmented reality is the same as virtual reality.,False
662,Technology,"The more technology we have, the easier it is to be distracted.",True
663,Technology,Search engines have made it easier to obtain information.,True
664,Technology,Smartphones have only been around for the past decade.,False
665,Technology,Online shopping has only become popular in recent years.,False
666,Technology,It is necessary to have antivirus software installed on a computer.,True
667,Technology,Cloud computing is the same as storing data on a physical hard drive.,False
668,Technology,Encryption is a way to protect sensitive data from hacking attacks.,True
669,Technology,Bluetooth technology can only be used for audio-related tasks.,False
670,Technology,Self-driving cars are now widely available for individual purchase.,False
671,Technology,Robots will eventually replace all human jobs.,False
672,Technology,Hackers only use their skills for illegal activities.,False
673,Technology,Gaming addiction is not a real problem.,False
674,Technology,Social media addiction is not a real problem.,False
675,Technology,Smart homes are only accessible to wealthy individuals.,False
676,Technology,Technology can be used to promote environmental sustainability.,True
677,Technology,Technology has brought about an increase in cyberbullying.,True
678,Technology,Digital art is not a legitimate form of art.,False
679,Technology,The use of paper is becoming obsolete in the age of technology.,False
680,Technology,Online communication is not as effective as face-to-face communication.,False
681,Technology,"Virtual assistants, such as Siri and Alexa, are capable of understanding all human accents.",False
682,Technology,Technology has made it easier to track criminal activity.,True
683,Technology,Streaming services have resulted in the decline of physical media sales.,True
684,Technology,E-readers have made physical books irrelevant.,False
685,Technology,Cybersecurity is a non-issue for individuals and businesses.,False
686,Technology,"The more technology we have, the less creative we become.",False
687,Technology,The use of technology in classrooms has had a negative impact on education.,False
688,Technology,Virtual conferencing is not as effective as in-person meetings.,False
689,Technology,The Internet of Things (IoT) refers to a network of interconnected smart devices.,True
690,Technology,3D printing technology is only used for manufacturing.,False
691,Technology,Technology has made it easier to connect with people from all over the world.,True
692,Technology,Mobile apps have become an essential part of our daily lives.,True
693,Technology,Technology has made it easier to work from remote locations.,True
694,Technology,Technology has made the world a safer place.,True
695,Technology,Technology has had no significant impact on the healthcare industry.,False
696,Technology,Technology has made it easier to access illicit materials online.,True
697,Technology,Technology has made it easier to create and spread fake news.,True
698,Technology,Selfies are a result of the rise of modern technology.,True
699,Politics,Political parties in the United States are officially recognized by the Constitution.,False
700,Politics,Only citizens of a country are allowed to participate in national politics.,True
701,Politics,Gerrymandering is legal in most democratic countries around the world.,False
702,Politics,Presidential elections are held every 4 years in the United States.,True
703,Politics,The age requirement to run for President of the United States is 40 years old.,False
704,Politics,North Korea is a democratic country.,False
705,Politics,Political candidates are allowed to receive unlimited amounts of money from individuals and corporations in their election campaigns.,False
706,Politics,"In many countries, voting is compulsory and citizens can be penalized for not voting.",True
707,Politics,Members of the European Parliament are elected directly by the citizens of each European Union country.,True
708,Politics,Countries with a one-party political system are always authoritarian.,False
709,Politics,"The term ""populist"" refers to a political ideology that promotes popular democracy and the rights of ordinary people.",True
710,Politics,The President of the United States is elected through a popular vote.,False
711,Politics,Democracy is a form of government where power is held by a single individual or group.,False
712,Politics,National elections are held on the same day in every country around the world.,False
713,Politics,The United Nations has the power to intervene in the domestic politics of member countries.,False
714,Politics,The political system in the United States prohibits anyone who has been convicted of a crime from running for office.,False
715,Politics,"In many countries, the judicial branch of government is completely independent from the legislative and executive branches.",True
716,Politics,Socialism is a political system where the means of production are owned and controlled by the government.,True
717,Politics,The majority of countries around the world have a two-party political system.,False
718,Politics,A constitution is a set of laws that outlines how a government should function.,True
719,Politics,The concept of taxation is not related to politics.,False
720,Politics,"In many countries, the political party with the most seats in parliament forms the government.",True
721,Politics,Communism is a political system where everyone has equal access to resources and wealth.,True
722,Politics,Freedom of speech is a universal right that is protected by most democratic countries.,True
723,Politics,The Speaker of the House in the United States is next in line for the presidency after the Vice President.,True
724,Politics,Dictatorship is a political system where power is held by a single individual who has complete control over the government and the country.,True
725,Politics,Political campaigns are not allowed to use social media platforms for advertising their candidates.,False
726,Politics,The United States is the only country in the world that has a presidential political system.,False
727,Politics,Fascism is a political system where the government is run by a single political party and allows no opposition or criticism.,True
728,Politics,The Senate in the United States has the power to confirm or reject Supreme Court nominees.,True
729,Politics,Anarchy is a political system where there is no government or central authority.,True
730,Politics,The President of the United States has the power to veto bills passed by Congress.,True
731,Politics,"The term ""political correctness"" refers to a set of language norms designed to promote inclusivity and avoid offense.",True
732,Politics,A monarchy is a political system where power is held by a single family or individual who inherits the position of leadership.,True
733,Politics,"In many countries around the world, citizens are allowed to vote at the age of 16.",False
734,Politics,Market economy is a type of economic system where prices are determined by supply and demand with no government intervention.,True
735,Politics,The President of the United States has the power to unilaterally declare war.,False
736,Politics,"In many countries, citizens are allowed to vote even if they don't have a registered permanent address.",True
737,Politics,The judicial branch of government has the power to interpret laws and make sure they are being followed.,True
738,Politics,Political parties in the United States are required to disclose the names of all their donors.,False
739,Politics,Countries with a parliamentary political system always have a Prime Minister instead of a President.,False
740,Politics,"In many countries, felons are not allowed to vote even after serving their time in prison.",True
741,Politics,Capitalism is a type of economic system where the means of production are privately owned and operated for profit.,True
742,Politics,The United States is the only country in the world with a federal political system.,False
743,Politics,"In many countries, political parties are required to have a minimum number of female candidates in their election campaigns.",True
744,Politics,Direct democracy is a political system where all citizens have an equal say in decision-making.,True
745,Politics,The judiciary branch of government is always the most powerful branch.,False
746,Politics,"In the United States, the Vice President is elected directly by the citizens.",False
747,Politics,The United Kingdom is a federal political system.,False
748,Politics,"In many countries, citizens are allowed to vote even if they haven't completed their education.",True
749,Business and Economy,The GDP of a country is solely determined by the government's policies.,False
750,Business and Economy,Recessions are always bad for businesses.,False
751,Business and Economy,Lowering taxes will always stimulate economic growth.,False
752,Business and Economy,Multinational corporations always exploit developing countries.,False
753,Business and Economy,Inflation is always caused by an increase in the money supply.,False
754,Business and Economy,The stock market accurately reflects the overall health of the economy.,False
755,Business and Economy,Economic growth means an increase in the quality of life for all citizens.,False
756,Business and Economy,The minimum wage can never be higher than the market wage.,False
757,Business and Economy,A recession is defined as two consecutive quarters of negative GDP growth.,True
758,Business and Economy,An increase in taxes will always lead to a decrease in consumer spending.,False
759,Business and Economy,A recession in one country will always lead to a recession in other countries.,False
760,Business and Economy,The United States has the largest economy in the world.,True
761,Business and Economy,The value of a company's stock is directly correlated with the success of the company.,False
762,Business and Economy,The government's deficit is always bad for the economy.,False
763,Business and Economy,Free trade is always a good thing for all countries involved.,False
764,Business and Economy,A higher inflation rate means that the economy is growing faster.,False
765,Business and Economy,A decrease in the unemployment rate always leads to wage growth for workers.,False
766,Business and Economy,A monopoly is always bad for consumers.,True
767,Business and Economy,Socialism is always bad for businesses.,False
768,Business and Economy,Supply-side economics believes that tax cuts for the wealthy will trickle down to benefit everyone.,True
769,Business and Economy,Tariffs always benefit domestic producers and hurt foreign producers.,False
770,Business and Economy,An increase in student loan debt will always lead to a decrease in entrepreneurship.,False
771,Business and Economy,The national debt is always a burden on future generations.,False
772,Business and Economy,A budget surplus always indicates a healthy economy.,False
773,Business and Economy,Subsidies always help businesses and boost economic growth.,False
774,Business and Economy,Economic freedom and political freedom have no correlation.,False
775,Business and Economy,A higher GDP per capita always leads to higher life expectancy.,False
776,Business and Economy,A decrease in the value of a country's currency always leads to increased exports.,True
777,Business and Economy,The European Union has a larger total GDP than the United States.,False
778,Business and Economy,Wealth inequality always leads to a decrease in economic growth.,False
779,Business and Economy,The GDP is a perfect measure of economic well-being.,False
780,Business and Economy,War always leads to increased economic growth.,False
781,Business and Economy,A higher minimum wage always leads to higher unemployment.,False
782,Business and Economy,"Entrepreneurs create jobs, but not necessarily economic growth.",True
783,Business and Economy,The world population will continue to grow indefinitely.,False
784,Business and Economy,A higher inflation rate always leads to higher interest rates.,True
785,Business and Economy,The government can always control the rate of inflation.,False
786,Business and Economy,International trade is always a zero-sum game.,False
787,Business and Economy,The gig economy is always bad for workers.,False
788,Business and Economy,Aggregate demand is the total demand for goods and services in an economy.,True
789,Business and Economy,The Phillips curve shows an inverse relationship between unemployment and inflation.,True
790,Business and Economy,Banks always create money when they make loans.,True
791,Business and Economy,Investment in education always leads to higher economic growth.,True
792,Business and Economy,The Great Depression was caused by a stock market crash.,False
793,Business and Economy,A recession can never turn into a depression.,False
794,Business and Economy,Economic growth can never lead to negative environmental externalities.,False
795,Business and Economy,Economic sanctions always achieve their desired political goals.,False
796,Business and Economy,Economic growth always leads to a decrease in poverty rates.,False
797,Business and Economy,A decrease in the trade deficit always leads to an increase in economic growth.,False
798,Business and Economy,Economic growth always leads to an increase in happiness.,False
799,Education,The only purpose of education is to obtain a degree.,False
800,Education,Public schools are required to teach religion.,False
801,Education,Homeschooling is illegal in many countries.,False
802,Education,Private schools are always better than public schools.,False
803,Education,All students with disabilities require specialized education.,False
804,Education,Students can legally drop out of school at any age.,False
805,Education,Online classes are an easier way to earn a degree.,False
806,Education,Standardized tests are the only way to measure a student's academic abilities.,False
807,Education,Education is only important for finding a job.,False
808,Education,All teachers are required to have a teaching degree.,False
809,Education,Bullying is not a significant problem in schools.,False
810,Education,It is easier to learn a new language when you are young.,True
811,Education,Education is the key to breaking the cycle of poverty.,True
812,Education,School funding is the same across all states in the US.,False
813,Education,Teachers do not receive a high salary.,True
814,Education,All schools offer the same extracurricular activities.,False
815,Education,More homework leads to better grades.,False
816,Education,College is the only way to succeed in life.,False
817,Education,Every student learns at the same pace.,False
818,Education,Education is important for personal growth.,True
819,Education,Students are not allowed to express their opinions in school.,False
820,Education,Homeschooling students are always isolated and lack social skills.,False
821,Education,Arts classes are not necessary for a well-rounded education.,False
822,Education,Every teacher provides the same quality of education.,False
823,Education,Bilingual education is not beneficial.,False
824,Education,Years of education always correlate with intelligence.,False
825,Education,Education can help promote empathy and understanding.,True
826,Education,The internet is a reliable source for school research.,False
827,Education,Standardized tests accurately measure teacher performance.,False
828,Education,Physical education classes are not necessary.,False
829,Education,Students are not allowed to challenge textbooks or curriculum.,False
830,Education,Technology cannot enhance classroom learning.,False
831,Education,Education can lead to a better understanding of other cultures.,True
832,Education,You need a college degree to be successful.,False
833,Education,Physical proximity to a school does not affect a student's education.,False
834,Education,School uniforms do not affect academic performance.,False
835,Education,Students always have access to proper resources for education.,False
836,Education,Teachers are not allowed to have personal opinions in class.,False
837,Education,Memorization is the only way to pass exams.,False
838,Education,Community colleges are not a good option for higher education.,False
839,Education,Education funding is always a top priority for governments.,False
840,Education,Only math and science classes are important for a career.,False
841,Education,Reading literature is not necessary for a comprehensive education.,False
842,Education,Music education does not affect academic success.,False
843,Education,Education is a lifelong process.,True
844,Education,Parents are not involved enough in their children's education.,False
845,Education,Education helps promote critical thinking skills.,True
846,Education,School shootings are not a significant problem.,False
847,Education,Private schools receive no government funding.,False
848,Education,Education can help reduce poverty rates.,True
849,Education,All students have access to equal educational opportunities.,False
850,Education,College is free in all countries.,False
851,Health and Fitness,Exercise is the best way to lose weight.,False
852,Health and Fitness,You should avoid all carbohydrates in your diet.,False
853,Health and Fitness,Running on a treadmill is the same as running outdoors.,False
854,Health and Fitness,Doing sit-ups is the only way to get a six-pack.,False
855,Health and Fitness,Lifting heavy weights will make you bulky.,False
856,Health and Fitness,"If you’re not sweating during your workout, you’re not burning enough calories.",False
857,Health and Fitness,Doing yoga is not a real workout.,False
858,Health and Fitness,Drinking water during exercise can cause cramps.,False
859,Health and Fitness,Eat fat-free foods to lose weight.,False
860,Health and Fitness,Stretching before exercise is not necessary.,False
861,Health and Fitness,Protein bars are a healthy snack alternative.,False
862,Health and Fitness,Taking supplements is necessary for a healthy diet.,False
863,Health and Fitness,Lifting weights will make you inflexible.,False
864,Health and Fitness,You can target fat loss in specific areas of your body.,False
865,Health and Fitness,Going to the gym every day is necessary for weight loss.,False
866,Health and Fitness,Weightlifting is not a good exercise for heart health.,False
867,Health and Fitness,Drinking more water will help you lose weight.,True
868,Health and Fitness,Running is bad for your knees.,False
869,Health and Fitness,Fad diets are a healthy way to lose weight.,False
870,Health and Fitness,Spot reduction is possible with targeted exercise.,False
871,Health and Fitness,Women who lift weights will become too muscular.,False
872,Health and Fitness,Lifting weights will ruin your posture.,False
873,Health and Fitness,You can only get a good workout at the gym.,False
874,Health and Fitness,Skipping meals is a good way to lose weight.,False
875,Health and Fitness,Cardio exercise is the only way to burn fat.,False
876,Health and Fitness,Eating after 8 pm will make you gain weight.,False
877,Health and Fitness,Drinking green tea will boost your metabolism.,True
878,Health and Fitness,More sweat equals more calories burned.,False
879,Health and Fitness,High-impact exercises are not good for your joints.,False
880,Health and Fitness,Having a gym membership guarantees weight loss.,False
881,Health and Fitness,You should avoid all fats in your diet.,False
882,Health and Fitness,Crunches are the best exercise for building abdominal muscles.,False
883,Health and Fitness,Squats are bad for your knees.,False
884,Health and Fitness,A healthy diet only involves eating fruits and vegetables.,False
885,Health and Fitness,You can eat whatever you want as long as you exercise regularly.,False
886,Health and Fitness,Lifting weights will cause women to develop breast cancer.,False
887,Health and Fitness,Sweating out toxins is essential for good health.,False
888,Health and Fitness,You should always stretch before a workout.,True
889,Health and Fitness,A snack before bed will cause nightmares.,False
890,Health and Fitness,Cardio exercise is the best way to reduce stress.,False
891,Health and Fitness,"The more athletic you are, the healthier you are.",False
892,Health and Fitness,You can eat fast food occasionally if you exercise enough.,False
893,Health and Fitness,Fruit juice is a healthy alternative to soda.,False
894,Health and Fitness,Running a marathon is the only way to get in good shape.,False
895,Health and Fitness,You should avoid all sugar in your diet.,False
896,Health and Fitness,Doing crunches is the best way to get rid of belly fat.,False
897,Health and Fitness,You should always listen to music while working out.,False
898,Health and Fitness,Drinking sports drinks is better than drinking water during a workout.,False
899,Health and Fitness,Lifting weights is only for young people.,False
900,Health and Fitness,You can’t exercise if you’re pregnant.,False
901,Environment and Climate,Climate change is caused solely by natural processes.,False
902,Environment and Climate,The ozone layer depletion is directly linked to global warming.,False
903,Environment and Climate,The earth's climate has remained constant over the last century.,False
904,Environment and Climate,The use of plastic bags contributes to climate change.,True
905,Environment and Climate,The Intergovernmental Panel on Climate Change (IPCC) has concluded that climate change is real and primarily caused by human activities.,True
906,Environment and Climate,"""Global warming"" and ""climate change"" refer to the same phenomenon.",False
907,Environment and Climate,Renewable energy sources like wind and solar power are more expensive than fossil fuels.,False
908,Environment and Climate,Climate change only affects certain regions of the world and not others.,False
909,Environment and Climate,Climate change is a myth.,False
910,Environment and Climate,The Arctic sea ice is increasing in size.,False
911,Environment and Climate,Climate change is a natural occurrence and has nothing to do with human activities.,False
912,Environment and Climate,The average temperature of the earth's surface has increased by about 1 degree Celsius since the pre-industrial era.,True
913,Environment and Climate,Deforestation does not have an impact on climate change.,False
914,Environment and Climate,Electric cars do not contribute to air pollution.,True
915,Environment and Climate,Carbon dioxide is the primary greenhouse gas emitted as a result of human activities.,True
916,Environment and Climate,The use of energy-efficient products has no effect on reducing greenhouse gas emissions.,False
917,Environment and Climate,The melting of glaciers is not a result of climate change.,False
918,Environment and Climate,The Paris Agreement aims to limit global warming to below 2 degrees Celsius.,True
919,Environment and Climate,Companies and industries are not responsible for contributing to climate change.,False
920,Environment and Climate,Natural disasters are not aggravated by climate change.,False
921,Environment and Climate,The earth's warming temperature will not lead to the extinction of certain animal and plant species.,False
922,Environment and Climate,The United States has withdrawn from the Paris Agreement.,True
923,Environment and Climate,Only carbon dioxide emissions contribute to climate change.,False
924,Environment and Climate,Climate change will not affect human health.,False
925,Environment and Climate,Climate change is a recent phenomenon.,False
926,Environment and Climate,Recycling has no impact on reducing greenhouse gas emissions.,False
927,Environment and Climate,The average sea level has risen by approximately 8 inches over the past century.,True
928,Environment and Climate,The Great Barrier Reef is not affected by climate change.,False
929,Environment and Climate,Carbon capture and storage technology is not an effective way to mitigate climate change.,False
930,Environment and Climate,The use of public transportation helps reduce greenhouse gas emissions.,True
931,Environment and Climate,Planting trees has no effect on mitigating climate change.,False
932,Environment and Climate,Climate change will not contribute to an increase in the frequency and severity of natural disasters.,False
933,Environment and Climate,The earth's temperature is not affected by the composition of the atmosphere.,False
934,Environment and Climate,Climate change will not lead to food scarcity.,False
935,Environment and Climate,Methane emissions have no impact on climate change.,False
936,Environment and Climate,Climate change will not lead to water scarcity.,False
937,Environment and Climate,The use of nuclear energy is an effective way to mitigate climate change.,True
938,Environment and Climate,Climate change is primarily caused by volcanic activity.,False
939,Environment and Climate,Climate change is not a pressing issue.,False
